[
  {
    "id": "b0000000-0000-0000-0000-000000000401",
    "requestCode": "BLK-ENG-DEL-401",
    "department": "ENGINEERING",
    "corridorId": "c0000000-0000-0000-0000-000000000001",
    "assetIds": ["a0000000-0000-0000-0000-000000000101"],
    "requestedStartTime": "2026-09-25T02:00:00Z",
    "requestedEndTime": "2026-09-25T05:00:00Z",
    "minDurationMinutes": 180,
    "flexible": true,
    "status": "SUBMITTED",
    "sourceSystem": "BDMS",
    "sourceRecordId": "BDMS-BLK-701",
    "ingestedAt": "2026-09-24T00:00:00Z",
    "updatedAt": "2026-09-24T00:00:00Z"
  },
  {
    "id": "b0000000-0000-0000-0000-000000000402",
    "requestCode": "BLK-SIG-DEL-402",
    "department": "SIGNAL_TELECOMMUNICATION",
    "corridorId": "c0000000-0000-0000-0000-000000000001",
    "assetIds": ["a0000000-0000-0000-0000-000000000102"],
    "requestedStartTime": "2026-09-25T02:30:00Z",
    "requestedEndTime": "2026-09-25T04:30:00Z",
    "minDurationMinutes": 120,
    "flexible": true,
    "status": "SUBMITTED",
    "sourceSystem": "SMMS",
    "sourceRecordId": "SMMS-BLK-702",
    "ingestedAt": "2026-09-24T00:00:00Z",
    "updatedAt": "2026-09-24T00:00:00Z"
  },
  {
    "id": "b0000000-0000-0000-0000-000000000403",
    "requestCode": "BLK-TRC-DEL-403",
    "department": "TRACTION",
    "corridorId": "c0000000-0000-0000-0000-000000000001",
    "assetIds": ["a0000000-0000-0000-0000-000000000103"],
    "requestedStartTime": "2026-09-25T02:15:00Z",
    "requestedEndTime": "2026-09-25T04:45:00Z",
    "minDurationMinutes": 150,
    "flexible": true,
    "status": "SUBMITTED",
    "sourceSystem": "TDMS",
    "sourceRecordId": "TDMS-BLK-703",
    "ingestedAt": "2026-09-24T00:00:00Z",
    "updatedAt": "2026-09-24T00:00:00Z"
  },
  {
    "id": "b0000000-0000-0000-0000-000000000404",
    "requestCode": "BLK-ENG-BPL-404",
    "department": "ENGINEERING",
    "corridorId": "c0000000-0000-0000-0000-000000000003",
    "assetIds": ["a0000000-0000-0000-0000-000000000106"],
    "requestedStartTime": "2026-09-25T01:00:00Z",
    "requestedEndTime": "2026-09-25T07:00:00Z",
    "minDurationMinutes": 360,
    "flexible": false,
    "status": "UNDER_REVIEW",
    "sourceSystem": "BDMS",
    "sourceRecordId": "BDMS-BLK-704",
    "ingestedAt": "2026-09-24T00:00:00Z",
    "updatedAt": "2026-09-24T00:00:00Z"
  }
]
